{
  "document_id": "document-1",
  "proposal_id": "proposal-1",
  "source_kind": "pasted_text",
  "document_status": "normalized",
  "pasted_text": "Clinicians spend several hours each week reconciling fragmented intake notes before AI project review.",
  "normalized_text": "Clinicians spend several hours each week reconciling fragmented intake notes before AI project review.",
  "source_refs": [
    {
      "source_id": "source-1",
      "source_kind": "pasted_text",
      "label": "Initial proposal text",
      "document_id": "document-1",
      "span": {
        "start_char": 0,
        "end_char": 96
      },
      "created_at": "2026-05-24T14:00:00.000Z"
    }
  ],
  "warnings": [],
  "created_at": "2026-05-24T14:00:00.000Z"
}
